{
  "schemaVersion": "memory-recall-card-v1",
  "memoryRef": "mem_fixture_001",
  "text": "A deterministic recall card fixture.",
  "sourcePublicationId": "11111111-1111-4111-8111-111111111111",
  "recallDisposition": "available",
  "provenance": {
    "publicationId": "11111111-1111-4111-8111-111111111111",
    "contractVersion": "0.1.0"
  }
}
